{
  "schema": "majordomus/design-system/v1",
  "generated": "GENERATED FILE — DO NOT EDIT DIRECTLY; source: share/design/tokens.yaml, the one declaration of the design; regenerate with `majordomus generate`",
  "generator": "majordomus-cli 1.0.0-alpha.9",
  "fingerprint": "b7914ad4140c57e51947f223bdd96d052020daa080f888a12fbf7e46f2e055a9",
  "design": "b7914ad4140c",
  "source": "share/design/tokens.yaml",
  "projections": [
    "share/design/theme.css",
    "share/design/surface.css",
    "share/design/status.css",
    "apps/majordomus-cli/src/web/tokens.css",
    "apps/majordomus-cli/src/design/tokens.yaml",
    "apps/majordomus-cli/src/cockpit/logo-mark.svg",
    "site/data/registry/design.json",
    "docs/generated/design.json",
    "docs/generated/design.yaml",
    "docs/generated/design.md"
  ],
  "counts": {
    "font": 2,
    "role": 22,
    "status": 5,
    "state": 105,
    "tone": 6,
    "type": 4,
    "tracking": 2,
    "layout": 3,
    "radius": 3,
    "motion": 1,
    "theme": 1,
    "palette": 66
  },
  "tokens": [
    {
      "name": "sans",
      "kind": "font",
      "about": "the system stack every surface reads in",
      "css": [
        "--font-sans",
        "font-sans"
      ],
      "value": "ui-sans-serif, system-ui, -apple-system, \"Segoe UI\", Roboto, \"Helvetica Neue\", Arial, \"Noto Sans\", sans-serif, \"Apple Color Emoji\", \"Segoe UI Emoji\", \"Segoe UI Symbol\", \"Noto Color Emoji\"",
      "projections": [
        "share/design/theme.css",
        "apps/majordomus-cli/src/web/tokens.css",
        "apps/majordomus-cli/src/design/tokens.yaml",
        "docs/generated/design.json",
        "docs/generated/design.yaml",
        "docs/generated/design.md"
      ]
    },
    {
      "name": "mono",
      "kind": "font",
      "about": "the monospace stack for code, identifiers and logs",
      "css": [
        "--font-mono",
        "font-mono"
      ],
      "value": "ui-monospace, SFMono-Regular, \"SF Mono\", Menlo, Consolas, \"Liberation Mono\", monospace",
      "projections": [
        "share/design/theme.css",
        "apps/majordomus-cli/src/web/tokens.css",
        "apps/majordomus-cli/src/design/tokens.yaml",
        "docs/generated/design.json",
        "docs/generated/design.yaml",
        "docs/generated/design.md"
      ]
    },
    {
      "name": "bg",
      "kind": "role",
      "about": "the page",
      "css": [
        "--mj-bg"
      ],
      "parts": [
        {
          "part": "fg",
          "css": "--mj-bg",
          "light": {
            "reference": "white",
            "css": "#fff",
            "literal": "#fff"
          },
          "dark": {
            "reference": "gray-950",
            "css": "oklch(13% 0.028 261.692)",
            "literal": "oklch(13% 0.028 261.692)"
          }
        }
      ],
      "aliases": [
        "--color-neutral-primary"
      ],
      "projections": [
        "share/design/theme.css",
        "share/design/surface.css",
        "share/design/status.css",
        "apps/majordomus-cli/src/web/tokens.css",
        "site/data/registry/design.json",
        "apps/majordomus-cli/src/design/tokens.yaml",
        "docs/generated/design.json",
        "docs/generated/design.yaml",
        "docs/generated/design.md"
      ]
    },
    {
      "name": "raised",
      "kind": "role",
      "about": "a card, a panel, a header bar that sits on the page",
      "css": [
        "--mj-raised"
      ],
      "parts": [
        {
          "part": "fg",
          "css": "--mj-raised",
          "light": {
            "reference": "white",
            "css": "#fff",
            "literal": "#fff"
          },
          "dark": {
            "reference": "gray-900",
            "css": "oklch(21% 0.034 264.665)",
            "literal": "oklch(21% 0.034 264.665)"
          }
        }
      ],
      "aliases": [
        "--color-neutral-primary-soft",
        "--color-neutral-primary-medium",
        "--color-neutral-primary-strong"
      ],
      "projections": [
        "share/design/theme.css",
        "share/design/surface.css",
        "share/design/status.css",
        "apps/majordomus-cli/src/web/tokens.css",
        "site/data/registry/design.json",
        "apps/majordomus-cli/src/design/tokens.yaml",
        "docs/generated/design.json",
        "docs/generated/design.yaml",
        "docs/generated/design.md"
      ]
    },
    {
      "name": "sunken",
      "kind": "role",
      "about": "a well, a table stripe, a code block, a header cell",
      "css": [
        "--mj-sunken"
      ],
      "parts": [
        {
          "part": "fg",
          "css": "--mj-sunken",
          "light": {
            "reference": "gray-50",
            "css": "oklch(98.5% 0.002 247.839)",
            "literal": "oklch(98.5% 0.002 247.839)"
          },
          "dark": {
            "reference": "gray-800",
            "css": "oklch(27.8% 0.033 256.848)",
            "literal": "oklch(27.8% 0.033 256.848)"
          }
        }
      ],
      "aliases": [
        "--color-neutral-secondary",
        "--color-neutral-secondary-soft",
        "--color-neutral-secondary-medium",
        "--color-neutral-secondary-strong"
      ],
      "projections": [
        "share/design/theme.css",
        "share/design/surface.css",
        "share/design/status.css",
        "apps/majordomus-cli/src/web/tokens.css",
        "site/data/registry/design.json",
        "apps/majordomus-cli/src/design/tokens.yaml",
        "docs/generated/design.json",
        "docs/generated/design.yaml",
        "docs/generated/design.md"
      ]
    },
    {
      "name": "line",
      "kind": "role",
      "about": "every border and rule",
      "css": [
        "--mj-line"
      ],
      "parts": [
        {
          "part": "fg",
          "css": "--mj-line",
          "light": {
            "reference": "gray-200",
            "css": "oklch(92.8% 0.006 264.531)",
            "literal": "oklch(92.8% 0.006 264.531)"
          },
          "dark": {
            "reference": "gray-800",
            "css": "oklch(27.8% 0.033 256.848)",
            "literal": "oklch(27.8% 0.033 256.848)"
          }
        }
      ],
      "aliases": [
        "--color-default",
        "--color-default-subtle",
        "--color-default-medium",
        "--color-default-strong"
      ],
      "projections": [
        "share/design/theme.css",
        "share/design/surface.css",
        "share/design/status.css",
        "apps/majordomus-cli/src/web/tokens.css",
        "site/data/registry/design.json",
        "apps/majordomus-cli/src/design/tokens.yaml",
        "docs/generated/design.json",
        "docs/generated/design.yaml",
        "docs/generated/design.md"
      ]
    },
    {
      "name": "fg",
      "kind": "role",
      "about": "headings, identifiers, values; the text that carries the page",
      "css": [
        "--mj-fg"
      ],
      "parts": [
        {
          "part": "fg",
          "css": "--mj-fg",
          "light": {
            "reference": "gray-900",
            "css": "oklch(21% 0.034 264.665)",
            "literal": "oklch(21% 0.034 264.665)"
          },
          "dark": {
            "reference": "white",
            "css": "#fff",
            "literal": "#fff"
          }
        }
      ],
      "aliases": [
        "--color-heading"
      ],
      "projections": [
        "share/design/theme.css",
        "share/design/surface.css",
        "share/design/status.css",
        "apps/majordomus-cli/src/web/tokens.css",
        "site/data/registry/design.json",
        "apps/majordomus-cli/src/design/tokens.yaml",
        "docs/generated/design.json",
        "docs/generated/design.yaml",
        "docs/generated/design.md"
      ]
    },
    {
      "name": "body",
      "kind": "role",
      "about": "reading text",
      "css": [
        "--mj-body"
      ],
      "parts": [
        {
          "part": "fg",
          "css": "--mj-body",
          "light": {
            "reference": "gray-600",
            "css": "oklch(44.6% 0.03 256.802)",
            "literal": "oklch(44.6% 0.03 256.802)"
          },
          "dark": {
            "reference": "gray-400",
            "css": "oklch(70.7% 0.022 261.325)",
            "literal": "oklch(70.7% 0.022 261.325)"
          }
        }
      ],
      "aliases": [
        "--color-body"
      ],
      "projections": [
        "share/design/theme.css",
        "share/design/surface.css",
        "share/design/status.css",
        "apps/majordomus-cli/src/web/tokens.css",
        "site/data/registry/design.json",
        "apps/majordomus-cli/src/design/tokens.yaml",
        "docs/generated/design.json",
        "docs/generated/design.yaml",
        "docs/generated/design.md"
      ]
    },
    {
      "name": "muted",
      "kind": "role",
      "about": "secondary text; labels, captions, provenance",
      "css": [
        "--mj-muted"
      ],
      "parts": [
        {
          "part": "fg",
          "css": "--mj-muted",
          "light": {
            "reference": "gray-500",
            "css": "oklch(55.1% 0.027 264.364)",
            "literal": "oklch(55.1% 0.027 264.364)"
          },
          "dark": {
            "reference": "gray-400",
            "css": "oklch(70.7% 0.022 261.325)",
            "literal": "oklch(70.7% 0.022 261.325)"
          }
        }
      ],
      "aliases": [
        "--color-body-subtle"
      ],
      "projections": [
        "share/design/theme.css",
        "share/design/surface.css",
        "share/design/status.css",
        "apps/majordomus-cli/src/web/tokens.css",
        "site/data/registry/design.json",
        "apps/majordomus-cli/src/design/tokens.yaml",
        "docs/generated/design.json",
        "docs/generated/design.yaml",
        "docs/generated/design.md"
      ]
    },
    {
      "name": "faint",
      "kind": "role",